issue type,summary,description,priority,parent
Story,Filter and Sort Order History,"As a user, I want to filter and sort my order history so that I can find specific orders easily. Gherkin scenarios cover filtering by date range, sorting by date/total, and filtering by status. Acceptance criteria include filter options (date, status, venue), sort options (date, total), applied filter indication, and result updates.",Medium,BPC-10
Story,Cancel an Order,"As a user, I want to cancel an order if it hasn't been prepared yet so that I can change my mind. Gherkin scenarios cover successful cancellation, cancellation window expiry, and refund processing. Acceptance criteria include cancel button, cancellation window, confirmation prompt, status check, refund processing, and email notification.",Medium,BPC-10
Story,Update Contact Details (Email & Phone),"As a user, I want to update my email address and phone number so that I receive order updates and can be reached if needed. Gherkin scenarios cover successful update, validation error, and duplicate email prevention. Acceptance criteria include editable email/phone fields, format validation, duplicate detection, update confirmation, and change notification.",High,BPC-11
Story,Update Birthday and Gender,"As a user, I want to update my birthday and gender so that my profile information is accurate. Gherkin scenarios cover successful update, invalid date prevention, and age verification check. Acceptance criteria include editable birthday/gender fields, date validation, age verification check, optional gender field, and update confirmation.",Medium,BPC-11
Story,Manage Addresses (Add & Edit),"As a user, I want to add, edit, and delete addresses so that I can manage my delivery locations. Gherkin scenarios cover adding new address, editing existing address, deleting address, and setting default address. Acceptance criteria include address form, validation, CRUD operations, default address option, and address list display.",Medium,BPC-11
Story,Manage Notification Preferences,"As a user, I want to control which notifications I receive so that I only get messages relevant to me. Gherkin scenarios cover viewing preferences, toggling notifications, and saving preferences. Acceptance criteria include notification types (order updates, promotions, rewards), toggle controls, preference saving, and default settings.",High,BPC-11
Story,Manage Marketing Communication Preferences,"As a user, I want to opt in or out of marketing emails and SMS so that I control promotional communications. Gherkin scenarios cover opting out of marketing, opting in to marketing, and preference persistence. Acceptance criteria include marketing opt-in/out toggles, email/SMS preferences, CAN-SPAM compliance, preference saving, and unsubscribe link.",High,BPC-11
Story,Manage Privacy Settings (Data Sharing & Cookies),"As a user, I want to manage my privacy settings including data sharing and cookie preferences so that I control my personal data. Gherkin scenarios cover data sharing preferences, cookie settings, and privacy preference saving. Acceptance criteria include data sharing toggles, cookie consent management, privacy policy link, GDPR/CCPA compliance, and preference persistence.",High,BPC-11
Story,Manage Consents and Permissions,"As a user, I want to review and manage all consents I've given (e.g., terms of service, data processing) so that I maintain control over my data. Gherkin scenarios cover viewing consents, withdrawing consent, and re-granting consent. Acceptance criteria include consent list, withdrawal option, re-grant option, consent history, and legal compliance.",Medium,BPC-11
Story,Validate Profile Data on Submit,"As the system, I need to validate all profile data before saving to ensure data integrity and security. Gherkin scenarios cover valid data submission, invalid email format, and invalid phone format. Acceptance criteria include field validation, format checks, required field enforcement, error messaging, and duplicate detection.",High,BPC-11
Story,Add New Payment Method,"As a user, I want to add new payment methods securely so I can easily make purchases without re-entering details every time. Gherkin scenarios cover successful card addition, invalid card rejection, and duplicate card prevention. Acceptance criteria include secure payment form, PCI compliance, Stripe tokenization, card validation, duplicate detection, and confirmation message.",High,BPC-12
Story,Set Default Payment Method,"As a user, I want to set a default payment method so that checkout is faster. Gherkin scenarios cover setting default method, default auto-selection, and changing default. Acceptance criteria include default toggle, auto-selection at checkout, visual indication, and update confirmation.",Medium,BPC-12
Story,Update Existing Payment Method,"As a user, I want to update payment method details (e.g., expiry date, billing address) so that my information stays current. Gherkin scenarios cover successful update, invalid data rejection, and Stripe update handling. Acceptance criteria include edit option, field updates, validation, Stripe sync, and update confirmation.",Medium,BPC-12
Story,View Payment History,"As a user, I want to view a history of my payments so I can track my transactions and identify any discrepancies. Gherkin scenarios cover viewing transaction history, filtering by date, and viewing transaction details. Acceptance criteria include chronological list, date/amount/order display, filter/sort options, detail access, and pagination.",Medium,BPC-12
Story,PCI Compliance for Payment Management,"As the system, I need to ensure all payment data handling complies with PCI DSS standards to protect user financial information. Acceptance criteria include PCI DSS compliance, no storage of sensitive card data, Stripe tokenization, secure data transmission, regular security audits, and compliance documentation.",High,BPC-12
Story,View Spending Patterns Over Time,"As a user, I want to view my spending patterns over time (e.g., weekly, monthly) so I can understand my consumption habits and manage my budget effectively. Gherkin scenarios cover spending graph display, time period filtering, and category breakdown. Acceptance criteria include spending visualization, time period filters, category breakdown, total spending display, and export option.",High,BPC-14
Story,Analyze Order Frequency,"As a user, I want to analyze how often I place orders so that I can track my ordering habits. Gherkin scenarios cover order frequency display, time period selection, and trend visualization. Acceptance criteria include frequency metrics, trend graphs, time period filters, average order value, and peak period identification.",Medium,BPC-14
Story,View Loyalty Points Earned and Redeemed,"As a user, I want to see how many points I've earned and redeemed over time so that I can track my loyalty program participation. Gherkin scenarios cover points analytics display, points breakdown, and time period filtering. Acceptance criteria include points earned/redeemed charts, time period filters, transaction breakdown, trend analysis, and points balance.",Medium,BPC-14
Story,Receive Personalized Insights and Recommendations,"As a user, I want to receive personalized insights about my spending and recommendations so that I can make better decisions. Gherkin scenarios cover insights display, recommendation generation, and insight dismissal. Acceptance criteria include personalized insights, spending recommendations, budget alerts, savings opportunities, and insight customization.",Medium,BPC-14
Story,Export Dashboard Data (CSV & PDF),"As a user, I want to export my dashboard data in CSV or PDF format so that I can keep records or share with others. Gherkin scenarios cover CSV export, PDF export, and export customization. Acceptance criteria include export buttons, CSV/PDF formats, data completeness, date range selection, and download confirmation.",Low,BPC-14
Story,Compare Analytics Across Time Periods,"As a user, I want to compare my spending and ordering patterns across different time periods so that I can identify trends. Gherkin scenarios cover period comparison, trend identification, and comparison visualization. Acceptance criteria include comparison mode, multiple period selection, side-by-side visualization, trend indicators, and export comparison.",Low,BPC-14
Story,Set Up Biometric Authentication (Face ID & Touch ID),"As a user, I want to set up biometric authentication (Face ID, Touch ID) so that I can log in securely and conveniently. Gherkin scenarios cover biometric enrollment, successful setup, device incompatibility, and biometric preference saving. Acceptance criteria include biometric enrollment flow, Face ID/Touch ID support, device compatibility check, preference persistence, and confirmation message.",High,BPC-15
Story,Disable Biometric Authentication,"As a user, I want to disable biometric authentication so that I can revert to password/OTP login if needed. Gherkin scenarios cover successful disabling, confirmation prompt, and fallback verification. Acceptance criteria include disable option, confirmation prompt, biometric removal, fallback to password/OTP, and preference update.",Medium,BPC-15
Story,Manage Biometric Preferences (When to Use Biometrics),"As a user, I want to customize when biometric authentication is required (e.g., login only vs. login + payment) so that I have control over security levels. Gherkin scenarios cover preference customization, preference saving, and preference application. Acceptance criteria include preference options, login/payment toggles, preference persistence, and immediate effect.",Medium,BPC-15
Story,Fallback to Password/OTP if Biometrics Fail,"As a user, I want to fall back to password or OTP authentication if biometric authentication fails so that I can still access my account. Gherkin scenarios cover biometric failure, fallback prompt, and successful OTP login. Acceptance criteria include biometric failure detection, automatic fallback prompt, OTP/password option, clear instructions, and retry option.",High,BPC-15
Story,Register Multiple Biometric Credentials,"As a user, I want to register multiple biometric credentials (e.g., different fingers, faces) so that I have flexible authentication options. Gherkin scenarios cover adding additional biometric, multiple credentials display, and credential removal. Acceptance criteria include multiple credential support, enrollment for each, credential list display, and individual removal.",Low,BPC-15
Story,View Biometric Authentication Audit Log,"As a user, I want to view a log of biometric authentication attempts so that I can monitor my account security. Gherkin scenarios cover audit log display, successful/failed attempts, and log filtering. Acceptance criteria include authentication log, date/time/device info, success/failure status, filter options, and retention period.",Low,BPC-15
Story,View Real-Time BAC Estimation,"As a user, I want to see my estimated Blood Alcohol Content (BAC) in real-time so that I can monitor my sobriety. Gherkin scenarios cover BAC display, BAC calculation update, and zero BAC state. Acceptance criteria include BAC percentage display, real-time updates, BAC calculation algorithm, visual indicators, and safety thresholds.",High,BPC-16
Story,Log Drinks for BAC Calculation,"As a user, I want to manually log drinks so that the BAC estimation is accurate. Gherkin scenarios cover drink logging, drink type selection, and log editing. Acceptance criteria include drink log form, drink type/volume/alcohol % selection, timestamp recording, BAC recalculation, and log history.",High,BPC-16
Story,Receive Safety Alerts Based on BAC Levels,"As a user, I want to receive safety alerts when my BAC reaches certain thresholds so that I can make responsible decisions. Gherkin scenarios cover low-level alert, high-level alert, and critical alert with intervention. Acceptance criteria include BAC threshold alerts, multi-level warnings, actionable recommendations, push/in-app notifications, and alert history.",High,BPC-16
Story,Connect Wearable Devices for Biometric Monitoring,"As a user, I want to connect wearable devices (e.g., Apple Watch, Fitbit) to track biometric data for more accurate BAC estimation. Gherkin scenarios cover device connection, biometric sync, and device disconnection. Acceptance criteria include wearable device integration, heart rate/temp sync, BAC calculation enhancement, device list display, and disconnect option.",Medium,BPC-16
Story,View Responsible Drinking Tips,"As a user, I want to view responsible drinking tips and resources so that I can stay informed about safe drinking practices. Gherkin scenarios cover tips display, tip categories, and resource links. Acceptance criteria include tips section, categorized content, external resource links, regular updates, and accessibility.",Medium,BPC-16
Story,End Drinking Session,"As a user, I want to end my drinking session to reset my BAC tracking and finalize session data. Gherkin scenarios cover session end, session summary, and auto-end after inactivity. Acceptance criteria include end session button, session summary, BAC reset, session archiving, and auto-end after 6 hours.",Medium,BPC-16
Story,Add Payment Method via Stripe,"As a user, I want to add a payment method securely via Stripe so that I can make purchases easily. Gherkin scenarios cover successful Stripe payment method addition, tokenization failure, and duplicate method prevention. Acceptance criteria include Stripe Elements integration, tokenization, PCI compliance, method storage, duplicate detection, and confirmation.",High,BPC-17
Story,View Saved Payment Methods,"As a user, I want to view all my saved payment methods so that I can manage them easily. Gherkin scenarios cover payment method list display, default method indication, and empty state handling. Acceptance criteria include method list display, card details (last 4 digits, expiry), default indication, and add method option.",High,BPC-17
Story,Remove Payment Method via Stripe,"As a user, I want to remove a saved payment method so that I can clean up unused methods. Gherkin scenarios cover successful removal, default method protection, and removal confirmation. Acceptance criteria include remove button, confirmation prompt, default method protection, Stripe detachment, and list update.",Medium,BPC-17
Story,Process Payment Securely via Stripe PaymentIntent,"As a user, I want my payments to be processed securely via Stripe PaymentIntent so that my transactions are safe. Gherkin scenarios cover successful payment processing, payment failure, and 3D Secure authentication. Acceptance criteria include PaymentIntent creation, 3D Secure support, payment confirmation, receipt generation, and error handling.",High,BPC-17
Story,Handle Payment Failures and Retries,"As a user, I want clear guidance when a payment fails so that I can resolve the issue and retry. Gherkin scenarios cover payment decline, insufficient funds, and retry after fixing. Acceptance criteria include failure detection, clear error messages, retry option, alternative method suggestion, and support link.",High,BPC-17
Story,Process Refunds via Stripe,"As a user, I want to receive refunds for canceled orders via Stripe so that I get my money back. Gherkin scenarios cover full refund processing, partial refund, and refund notification. Acceptance criteria include refund initiation, full/partial refund support, Stripe Refund API, processing time notification, and email confirmation.",Medium,BPC-17
Story,Handle Stripe Webhooks for Payment Events,"As the system, I need to handle Stripe webhooks to process payment events (success, failure, disputes) in real-time. Acceptance criteria include webhook endpoint, signature verification, event handling (payment_intent.succeeded, payment_intent.payment_failed, charge.dispute.created), idempotency, retry logic, and logging.",High,BPC-17
Story,Support Subscription Billing via Stripe,"As a user, I want to subscribe to recurring services and have payments processed automatically via Stripe. Gherkin scenarios cover subscription creation, automatic renewal, and cancellation. Acceptance criteria include Stripe Subscription API, plan selection, automatic billing, subscription management, and email notifications.",Low,BPC-17
Story,Display Payment Analytics and Insights,"As an admin, I want to view payment analytics (transaction volume, success rates, revenue) so that I can monitor business performance. Acceptance criteria include analytics dashboard, transaction volume, success/failure rates, revenue metrics, refund tracking, and data export.",Low,BPC-17
Story,Accept Cookie Consent,"As a visitor, I want to accept or decline cookie consent so that I control how my data is tracked. Gherkin scenarios cover cookie banner display, accepting all cookies, declining non-essential cookies, and preference saving. Acceptance criteria include cookie banner, accept/decline options, cookie categorization, preference persistence, and re-consent prompt.",High,BPC-18
Story,Manage Cookie Preferences,"As a user, I want to manage my cookie preferences (essential, functional, analytics, marketing) so that I have granular control. Gherkin scenarios cover viewing preferences, customizing categories, and saving preferences. Acceptance criteria include cookie settings page, category toggles, essential cookies always-on, preference saving, and re-consent option.",Medium,BPC-18
Story,Request Data Export (GDPR/CCPA),"As a user, I want to request an export of all my personal data so that I can review what information is stored about me. Gherkin scenarios cover data export request, export file generation, and download access. Acceptance criteria include export request form, GDPR/CCPA compliance, data compilation (profile, orders, payments, consents), JSON/CSV format, email notification, and 30-day access.",High,BPC-18
Story,Request Data Deletion (Right to be Forgotten),"As a user, I want to request deletion of my personal data so that I can exercise my right to be forgotten. Gherkin scenarios cover deletion request, account deactivation, and deletion confirmation. Acceptance criteria include deletion request form, confirmation prompt, account deactivation, data anonymization, 30-day retention period, and deletion confirmation email.",High,BPC-18
Story,View Privacy Policy,"As a user, I want to view the privacy policy so that I understand how my data is used. Gherkin scenarios cover policy access, policy updates, and version history. Acceptance criteria include privacy policy page, plain language, data usage explanation, update notifications, and version history.",Medium,BPC-18
Story,View Terms of Service,"As a user, I want to view the terms of service so that I understand the rules and agreements. Gherkin scenarios cover terms access and acceptance requirement. Acceptance criteria include terms page, clear language, acceptance requirement on signup, update notifications, and version history.",Medium,BPC-18
Story,Manage Data Sharing Preferences,"As a user, I want to control how my data is shared with third parties so that I maintain privacy. Gherkin scenarios cover viewing sharing preferences, opting out of sharing, and saving preferences. Acceptance criteria include data sharing settings, third-party list, opt-in/opt-out toggles, preference persistence, and GDPR/CCPA compliance.",High,BPC-18
Story,View Security Audit Log,"As a user, I want to view a log of security-related activities (logins, password changes) so that I can monitor my account. Gherkin scenarios cover audit log access, activity filtering, and suspicious activity detection. Acceptance criteria include audit log page, activity types (login, password change, payment method update), date/time/device info, filter options, and suspicious activity alerts.",Medium,BPC-18
Story,Report Data Privacy Concerns,"As a user, I want to report data privacy concerns or breaches so that issues can be addressed. Gherkin scenarios cover concern submission, acknowledgment, and resolution update. Acceptance criteria include privacy concern form, issue categorization, submission confirmation, acknowledgment email, and resolution tracking.",Low,BPC-18
Story,View Venue Partnership Landing Page,"As a venue owner, I want to view a landing page explaining the partnership program so that I can learn about the benefits. Gherkin scenarios cover landing page access, benefits display, and CTA navigation. Acceptance criteria include partnership landing page, benefits section, testimonials, CTA buttons, and responsive design.",High,BPC-19
Story,View Partnership Benefits and Features,"As a venue owner, I want to see detailed benefits and features of partnering so that I can make an informed decision. Gherkin scenarios cover benefits display, feature comparison, and pricing transparency. Acceptance criteria include benefits list, feature comparison table, pricing info, ROI examples, and visual aids.",High,BPC-19
Story,Submit Partnership Inquiry Form,"As a venue owner, I want to submit an inquiry to learn more about partnering so that I can start the onboarding process. Gherkin scenarios cover successful form submission, validation error handling, and confirmation email. Acceptance criteria include inquiry form (venue name, contact, location, interest), field validation, submission confirmation, and email acknowledgment.",High,BPC-19
Story,View Partnership Program Details,"As a venue owner, I want to view detailed program information (onboarding, support, marketing) so that I understand what's involved. Gherkin scenarios cover program details access and FAQ navigation. Acceptance criteria include program details page, onboarding steps, support info, marketing resources, FAQs, and contact info.",Medium,BPC-19
Story,Receive Partnership Inquiry Confirmation,"As a venue owner, I want to receive confirmation after submitting an inquiry so that I know my request was received. Gherkin scenarios cover email confirmation, confirmation page display, and follow-up timeline. Acceptance criteria include confirmation email, inquiry summary, next steps, timeline, and contact info.",High,BPC-19
Story,Track Partnership Lead Status (Admin),"As an admin, I want to track and manage partnership leads so that I can follow up effectively. Acceptance criteria include admin dashboard, lead list, status tracking, assignment, notes, and follow-up reminders.",Medium,BPC-19
Story,Create Buddy List,"As a user, I want to create a buddy list of friends so that I can easily assign drinks to them in group orders. Gherkin scenarios cover adding buddies, buddy confirmation, and buddy list display. Acceptance criteria include buddy management UI, add/remove buddies, buddy confirmation, buddy list display, and search functionality.",High,BPC-20
Story,Assign Drinks to Buddies,"As a user, I want to assign drinks to my buddies when adding items to the cart so that I can order for my friends. Gherkin scenarios cover drink assignment, assignment display, and reassignment. Acceptance criteria include assignment UI, buddy selection, assignment confirmation, visual indication, and edit option.",High,BPC-20
Story,Accept or Decline Assigned Drinks,"As a buddy, I want to accept or decline drinks assigned to me so that I control what I consume. Gherkin scenarios cover drink acceptance, drink decline, and notification. Acceptance criteria include assignment notification, accept/decline options, response tracking, notification to assigner, and expiry (15 minutes).",High,BPC-20
Story,Integrate Assigned Drinks into Sobriety Monitor,"As a user, I want accepted assigned drinks to be tracked in my sobriety monitor so that my BAC estimation is accurate. Gherkin scenarios cover drink tracking, BAC update, and alert triggering. Acceptance criteria include automatic drink logging, BAC recalculation, sobriety monitor integration, and safety alerts.",High,BPC-20
Story,Create Group Order,"As a user, I want to create a group order for multiple people so that we can order together. Gherkin scenarios cover group order creation, buddy invitation, and order coordination. Acceptance criteria include group order UI, buddy selection, invitation sending, order consolidation, and group summary.",Medium,BPC-20
Story,Split Payment for Group Orders,"As a user, I want to split payment for group orders so that everyone pays their share. Gherkin scenarios cover payment splitting, individual payment, and payment confirmation. Acceptance criteria include split payment UI, itemized breakdown, individual payment processing, payment tracking, and completion notification.",Medium,BPC-20
Story,View Group Order History,"As a user, I want to view my group order history so that I can track past group purchases. Gherkin scenarios cover group order list display, order details access, and buddy identification. Acceptance criteria include group order list, order details, buddy names, payment split, and filter options.",Low,BPC-20
Story,Get Real-Time Safety Recommendations,"As a user, I want to receive real-time AI-powered safety recommendations based on my BAC so that I can make responsible decisions. Gherkin scenarios cover safety recommendation display, personalized advice, and recommendation dismissal. Acceptance criteria include AI-generated recommendations, BAC-based advice, alternative suggestions, real-time updates, and user dismissal.",High,BPC-21
Story,Receive Predictive BAC Alerts,"As a user, I want to receive predictive BAC alerts before I reach unsafe levels so that I can pace myself. Gherkin scenarios cover predictive alert display, alert customization, and alert acknowledgment. Acceptance criteria include predictive algorithm, early warning alerts, customizable thresholds, visual/audio notifications, and acknowledgment tracking.",High,BPC-21
