issue type,summary,description,priority,parent
Story,Get AI Intervention Strategies,"As a user, I want AI-suggested intervention strategies when my BAC is high so that I can sober up safely. Gherkin scenarios cover intervention suggestion, resource provision, and intervention tracking. Acceptance criteria include AI-generated interventions, food/water suggestions, rest recommendations, ride-sharing links, and effectiveness tracking.",High,BPC-21
Story,Receive Emergency Notifications,"As a user, I want emergency notifications sent to my emergency contacts if my BAC reaches critical levels so that I get help. Gherkin scenarios cover emergency alert triggering, contact notification, and location sharing. Acceptance criteria include critical BAC threshold, emergency contact notification, location sharing, automated messaging, and user override.",Medium,BPC-21
Story,Track AI Advisor Effectiveness,"As an admin, I want to track the effectiveness of AI sobriety recommendations so that we can improve the system. Acceptance criteria include effectiveness metrics, user engagement tracking, BAC reduction correlation, feedback collection, and recommendation optimization.",Low,BPC-21
Story,Use Voice Commands to Browse Menu,"As a user, I want to browse the menu using voice commands so that I can order hands-free. Gherkin scenarios cover voice browsing activation, category navigation, and product selection. Acceptance criteria include voice activation, natural language processing, menu navigation, product details, and voice feedback.",High,BPC-22
Story,Add Items to Cart via Voice,"As a user, I want to add items to my cart using voice commands so that I can build an order hands-free. Gherkin scenarios cover voice add-to-cart, quantity specification, and cart confirmation. Acceptance criteria include voice add command, quantity recognition, cart update, voice confirmation, and error correction.",High,BPC-22
Story,Complete Checkout via Voice,"As a user, I want to complete checkout using voice commands so that I can finalize my order hands-free. Gherkin scenarios cover voice checkout initiation, payment confirmation, and order placement. Acceptance criteria include voice checkout command, order summary, payment confirmation, voice authentication, and order confirmation.",Medium,BPC-22
Story,Voice Search for Products,"As a user, I want to search for products using voice commands so that I can find items quickly. Gherkin scenarios cover voice search activation, query recognition, and result display. Acceptance criteria include voice search activation, natural language query, search result display, voice result readout, and visual fallback.",High,BPC-22
Story,Voice-Activated Accessibility Features,"As a user with accessibility needs, I want voice-activated features so that I can use the app without touch input. Gherkin scenarios cover accessibility mode activation, navigation assistance, and voice feedback. Acceptance criteria include accessibility mode, full voice navigation, screen reader integration, voice feedback, and customization.",Medium,BPC-22
Story,Multi-Language Voice Support,"As a multilingual user, I want voice commands to support my preferred language so that I can order in my native language. Gherkin scenarios cover language selection, multilingual voice recognition, and language switching. Acceptance criteria include language selection, multi-language support, accent recognition, language switching, and translation.",Low,BPC-22
Story,Set Up Allergen Profile,"As a user, I want to create an allergen profile listing my allergies so that the app can warn me about unsafe products. Gherkin scenarios cover profile creation, allergen selection, and severity indication. Acceptance criteria include allergen profile UI, allergen list, severity levels, profile saving, and edit option.",High,BPC-23
Story,Receive Real-Time Allergen Warnings,"As a user, I want to receive real-time warnings when viewing products containing my allergens so that I can avoid them. Gherkin scenarios cover allergen detection, warning display, and warning acknowledgment. Acceptance criteria include allergen scanning, real-time warnings, visual alerts, severity-based messaging, and acknowledgment.",High,BPC-23
Story,Get Alternative Product Suggestions,"As a user, I want AI-suggested alternatives when a product contains my allergens so that I can find safe options. Gherkin scenarios cover alternative suggestion, safe product display, and alternative selection. Acceptance criteria include AI-generated alternatives, allergen-free options, visual display, similarity matching, and easy selection.",High,BPC-23
Story,Detect Cross-Contamination Warnings,"As a user, I want to be warned about potential cross-contamination risks so that I can make informed decisions. Gherkin scenarios cover cross-contamination detection, warning display, and risk explanation. Acceptance criteria include cross-contamination scanning, risk level indication, detailed explanations, source identification, and acknowledgment.",Medium,BPC-23
Story,Track Allergen Exposure History,"As a user, I want to track my allergen exposure history so that I can identify patterns. Gherkin scenarios cover exposure log display, incident recording, and pattern analysis. Acceptance criteria include exposure log, incident details, pattern detection, visual analytics, and export option.",Low,BPC-23
Story,Get AI-Powered Venue Recommendations,"As a user, I want AI-powered venue recommendations based on my preferences so that I discover great places. Gherkin scenarios cover recommendation display, preference learning, and recommendation feedback. Acceptance criteria include AI recommendations, preference-based matching, collaborative filtering, visual display, and feedback collection.",High,BPC-24
Story,Receive Occasion-Based Venue Suggestions,"As a user, I want venue suggestions based on the occasion (date night, sports game, happy hour) so that I find the perfect spot. Gherkin scenarios cover occasion selection, suggestion display, and occasion customization. Acceptance criteria include occasion types, context-aware suggestions, AI matching, visual display, and custom occasion creation.",High,BPC-24
Story,Match Venues Based on Social Group Preferences,"As a user, I want venue suggestions that match my social group's preferences so that everyone is happy. Gherkin scenarios cover group preference input, venue matching, and group consensus. Acceptance criteria include group selection, preference aggregation, AI matching, consensus scoring, and suggestion display.",Medium,BPC-24
Story,View Real-Time Venue Availability and Wait Times,"As a user, I want to see real-time venue availability and wait times so that I can choose accordingly. Gherkin scenarios cover availability display, wait time estimation, and live updates. Acceptance criteria include real-time data, availability status, wait time estimates, live updates, and alternative suggestions.",Medium,BPC-24
Story,Receive Personalized Venue Rankings,"As a user, I want venues ranked based on my personal preferences so that the best matches appear first. Gherkin scenarios cover ranking display, ranking explanation, and ranking customization. Acceptance criteria include personalized ranking algorithm, preference weighting, ranking scores, explanation, and customization.",Low,BPC-24
Story,Coordinate Group Order with AI Assistant,"As a user, I want an AI assistant to help coordinate group orders so that everyone gets what they want. Gherkin scenarios cover AI coordination initiation, preference collection, and order consolidation. Acceptance criteria include AI assistant UI, preference collection, conflict resolution, order consolidation, and confirmation.",High,BPC-25
Story,Resolve Conflicting Preferences with AI,"As a user, I want AI to resolve conflicting preferences in group orders so that we reach consensus. Gherkin scenarios cover conflict detection, AI resolution suggestion, and consensus display. Acceptance criteria include conflict detection, AI-generated compromises, voting options, consensus tracking, and final decision.",Medium,BPC-25
Story,Optimize Group Order Budget with AI,"As a user, I want AI to help optimize our group order budget so that we stay within spending limits. Gherkin scenarios cover budget input, AI optimization, and budget tracking. Acceptance criteria include budget input, AI cost optimization, alternative suggestions, real-time tracking, and budget alerts.",Medium,BPC-25
Story,Coordinate Timing for Group Orders,"As a user, I want AI to coordinate timing for group orders so that everyone's orders arrive together. Gherkin scenarios cover timing coordination, preparation time estimation, and synchronized delivery. Acceptance criteria include timing coordination, prep time estimation, synchronized ordering, delivery scheduling, and timing notifications.",Low,BPC-25
Story,Accommodate Dietary Restrictions in Group Orders,"As a user, I want AI to ensure dietary restrictions are accommodated in group orders so that everyone can eat safely. Gherkin scenarios cover dietary restriction input, AI accommodation, and restriction verification. Acceptance criteria include dietary restriction collection, AI filtering, safe options display, restriction verification, and allergen warnings.",Medium,BPC-25
Story,Get AI-Powered Spending Insights,"As a user, I want AI-powered insights into my spending patterns so that I understand my habits. Gherkin scenarios cover insights display, pattern recognition, and insight customization. Acceptance criteria include AI spending analysis, pattern detection, visual insights, trend identification, and customization.",High,BPC-26
Story,Categorize Spending Automatically with AI,"As a user, I want AI to automatically categorize my spending so that I can track expenses by category. Gherkin scenarios cover auto-categorization, category display, and manual adjustment. Acceptance criteria include AI categorization, spending categories, visual breakdown, manual override, and category history.",High,BPC-26
Story,Receive Budget Alerts and Recommendations,"As a user, I want AI to alert me when I'm approaching budget limits and suggest adjustments. Gherkin scenarios cover budget setup, AI monitoring, and alert triggering. Acceptance criteria include budget configuration, AI monitoring, threshold alerts, spending recommendations, and alert customization.",Medium,BPC-26
Story,Track Tax and Expense for Reporting,"As a user, I want AI to track tax and expenses for easy reporting so that I can file accurately. Gherkin scenarios cover tax tracking, expense reporting, and report generation. Acceptance criteria include tax calculation, expense categorization, AI report generation, export formats, and tax year organization.",Low,BPC-26
Story,Get Predictive Spending Forecasts,"As a user, I want AI to forecast my future spending based on patterns so that I can plan ahead. Gherkin scenarios cover forecast display, forecast accuracy, and forecast adjustment. Acceptance criteria include AI forecasting, trend-based predictions, visual forecasts, accuracy metrics, and scenario planning.",Low,BPC-26